{"schema_version":1,"session_id":"S-SYNTH001","cohort":"nonexpert","consent":{"granted":true,"protocol_version":"v1","captured_at":"2030-01-01T00:00:00Z","collection_mode":"anonymous-structured-only"},"retention":{"policy_version":"synthetic-test-only","delete_after":"2030-01-02"},"tasks":[{"task_id":"novice-agent","expected_artifact":"agent","initial_artifact":"skill","final_artifact":"agent","completed":true,"facilitator_corrections":0,"participant_questions":1,"wrong_artifact_recovered":true,"comprehension_score":4,"time_to_first_candidate_ms":1000,"confidence":4}],"findings":[{"code":"SYNTH-GAP","title":"Synthetic routing label","classification":"documentation-gap","severity":"P1","task_id":"novice-agent","description":"Fictional description used only to exercise deterministic output.","privacy_reviewed":true}]}
